{
 "$schema": "https://aij.eddy3d.com/api/3.9.1/schemas/submission.schema.json",
 "schema_version": "2.5.0",
 "data_version": "dbb457d2ee2e67055cd85e33a146ccb770e6971db05d6cebaa366410a72f0dae",
 "license": "CC-BY-4.0",
 "slug": "eddy3d-of12-nutcap-lifted",
 "submission": {
  "solver": "OpenFOAM simpleFoam (Eddy3D Outdoor case writer)",
  "version": "12",
  "url": "https://openfoam.org",
  "author": "Sustainable Urban Systems Lab",
  "licence": "CC-BY-4.0",
  "contact": "https://github.com/Eddy3D-Dev/AIJ-Data-Validation/discussions",
  "inlet": "the served fitted log law",
  "mesh": "snappyHexMesh, 1:100 scale, the served runs' mesh and numerics level 3",
  "turbulence_model": "realizable k-epsilon, nutMaxCoeff 1e8",
  "compute": "3000 iterations, steady, 5-6 ranks (Case A on an Apple M-series laptop, B and H on PACE Phoenix)",
  "units": "normalised",
  "notes": "Case D is the 0 degree heading only (the fixture stopped at its mirrored-plane probe before the other headings; PACE ICE job 6465404). Case G is the conifer crown of the drag sweep, where lifting the cap makes the result worse (a worse score, submitted all the same). Case C (all nine configurations, scalar speed sampled from the solved fields of the ICE re-solves), Cases F (wind from NNW) and M (WD 180, Sct 0.5) are the Eddy3D fixtures re-solved by another session on PACE ICE with the same cap change, scored here from their probe files. Same fixtures as the served runs (Eddy3D docs/VALIDATION.md) with only the cap changed. Case H cstar is the Sct = 0.5 species. Case B is the served set-up with the cap lifted (the capped control of the same fixture reproduces the served B scores to the third digit)."
 },
 "example": false,
 "provenance": "self-reported inputs (the values in submissions/<slug>/cases/<id>/probes.csv), scored by this repository's build with validation/score_submissions.py; not an Eddy3D result and not checked by the maintainers beyond the scoring",
 "scored_with": {
  "script": "validation/score_submissions.py",
  "release": "3.9.1",
  "conventions": "velocities and the speed over U_ref, k over U_ref^2 (Cases E, F and G publish ratios already); U, V, W, |U| and the thermistor bracket scored as signed velocities (FAC2's ratio keeps the sign; hit rate D = 0.25, W = 0.05); k by the plain definitions (D = 0.25 only); a thermistor, cup or sonic reading (a mean scalar speed) scored against |U| (vs.vector) and sqrt(|U|^2 + 2k) (vs.scalar), the two ends of its bracket; c* = C/c0 with one detection limit per case, 1e-3 of the largest measured value; theta = (T_floor - T)/(T_floor - T_H) scored like a positive velocity. The same conventions score the served Eddy3D results (docs/validation/method.md).",
  "metric_meaning": {
   "Count": "number of measured points scored",
   "MeanObserved": "mean of the measured, normalised quantity",
   "MeanPredicted": "mean of the modelled, normalised quantity",
   "Fb": "fractional bias, 2 (mean_obs - mean_pred) / (mean_obs + mean_pred); positive = model low",
   "Nmse": "normalised mean square error",
   "Nad": "normalised absolute difference",
   "Fac2": "fraction of points within a factor of two (harsh near zero for sign-changing V and W)",
   "HitRate": "fraction of points within D = 0.25 relative or W = 0.05 U_H absolute",
   "Mg": "geometric mean bias",
   "Vg": "geometric variance",
   "GeometricPairs": "pairs with both values positive (used for Mg/Vg)",
   "R": "Pearson correlation coefficient",
   "null": "a metric that is undefined for the data (for example Mg and Vg when no pair has both values positive; Fb, Nmse and Nad of a signed velocity component of Case H or I whose observed and predicted means are not both positive)"
  }
 },
 "folder": "https://github.com/Eddy3D-Dev/AIJ-Data-Validation/tree/main/submissions/eddy3d-of12-nutcap-lifted",
 "cases": [
  {
   "case": "A",
   "title": "Case A — 1:1:2 building",
   "status": "scored",
   "headline": [
    {
     "label": "U",
     "score": "velocity.U",
     "Count": 186,
     "R": 0.9535278045093767,
     "Fac2": 0.8225806451612904,
     "Fb": 0.16627220895995706,
     "HitRate": 0.6129032258064516,
     "coverage": {
      "scored": 186,
      "measured": 186
     }
    },
    {
     "label": "V",
     "score": "velocity.V",
     "Count": 186,
     "R": 0.9621359539198044,
     "Fac2": 0.3602150537634409,
     "Fb": null,
     "HitRate": 0.9032258064516129,
     "coverage": {
      "scored": 186,
      "measured": 186
     }
    },
    {
     "label": "W",
     "score": "velocity.W",
     "Count": 186,
     "R": 0.7091597829771744,
     "Fac2": 0.4032258064516129,
     "Fb": -1.362295020090697,
     "HitRate": 0.8333333333333334,
     "coverage": {
      "scored": 186,
      "measured": 186
     }
    },
    {
     "label": "|U|",
     "score": "speed",
     "Count": 186,
     "R": 0.939760267128119,
     "Fac2": 0.8655913978494624,
     "Fb": 0.12973666003550258,
     "HitRate": 0.6666666666666666,
     "coverage": {
      "scored": 186,
      "measured": 186
     }
    },
    {
     "label": "k",
     "score": "k",
     "Count": 186,
     "R": 0.38965019455280847,
     "Fac2": 0.6774193548387096,
     "Fb": 0.3937542841804471,
     "HitRate": 0.24731182795698925,
     "coverage": {
      "scored": 186,
      "measured": 186
     }
    }
   ],
   "values": {
    "url": "https://aij.eddy3d.com/api/3.9.1/submissions/eddy3d-of12-nutcap-lifted/A.csv?v=d55ee1f8ca3c",
    "path": "submissions/eddy3d-of12-nutcap-lifted/A.csv",
    "media_type": "text/csv",
    "bytes": 23456,
    "sha256": "d55ee1f8ca3c9f868661028c27e5b4a4a6a6b2b69967217fd6c92645c8ca3afb"
   },
   "scores": {
    "velocity.U": {
     "Count": 186,
     "MeanObserved": 0.6348264031048957,
     "MeanPredicted": 0.5373742104268274,
     "Fb": 0.16627220895995706,
     "Nmse": 0.07129844699908189,
     "Nad": 0.10333735917376988,
     "Fac2": 0.8225806451612904,
     "HitRate": 0.6129032258064516,
     "Mg": 1.2180466506490562,
     "Vg": 1.6146556858553873,
     "GeometricPairs": 158,
     "R": 0.9535278045093767
    },
    "velocity.V": {
     "Count": 186,
     "MeanObserved": -0.04043331585512722,
     "MeanPredicted": -0.048693310770014236,
     "Fb": null,
     "Nmse": null,
     "Nad": null,
     "Fac2": 0.3602150537634409,
     "HitRate": 0.9032258064516129,
     "Mg": 4.000189640361174,
     "Vg": 4679.305126166496,
     "GeometricPairs": 44,
     "R": 0.9621359539198044
    },
    "velocity.W": {
     "Count": 186,
     "MeanObserved": 0.0013814965654127857,
     "MeanPredicted": 0.007283930921819746,
     "Fb": -1.362295020090697,
     "Nmse": 409.8493871310459,
     "Nad": 4.174502010073533,
     "Fac2": 0.4032258064516129,
     "HitRate": 0.8333333333333334,
     "Mg": 0.9432259896165625,
     "Vg": 2.429472999275036,
     "GeometricPairs": 66,
     "R": 0.7091597829771744
    },
    "speed": {
     "Count": 186,
     "MeanObserved": 0.6738722238666145,
     "MeanPredicted": 0.5917719968707627,
     "Fb": 0.12973666003550258,
     "Nmse": 0.05421819016726797,
     "Nad": 0.08815145021586458,
     "Fac2": 0.8655913978494624,
     "HitRate": 0.6666666666666666,
     "Mg": 1.209965071925292,
     "Vg": 1.3941044159798854,
     "GeometricPairs": 186,
     "R": 0.939760267128119
    },
    "k": {
     "Count": 186,
     "MeanObserved": 0.05589626736518246,
     "MeanPredicted": 0.03750724983720198,
     "Fb": 0.3937542841804471,
     "Nmse": 0.610022270970999,
     "Nad": 0.29033016625459784,
     "Fac2": 0.6774193548387096,
     "HitRate": 0.24731182795698925,
     "Mg": 1.5107812740791322,
     "Vg": 1.638573379362542,
     "GeometricPairs": 186,
     "R": 0.38965019455280847
    }
   },
   "coverage": {
    "velocity.U": {
     "scored": 186,
     "measured": 186
    },
    "velocity.V": {
     "scored": 186,
     "measured": 186
    },
    "velocity.W": {
     "scored": 186,
     "measured": 186
    },
    "speed": {
     "scored": 186,
     "measured": 186
    },
    "k": {
     "scored": 186,
     "measured": 186
    }
   },
   "groups": [
    {
     "key": "",
     "group": {},
     "points_measured": 186,
     "scores": {
      "velocity.U": {
       "Count": 186,
       "MeanObserved": 0.6348264031048957,
       "MeanPredicted": 0.5373742104268274,
       "Fb": 0.16627220895995706,
       "Nmse": 0.07129844699908189,
       "Nad": 0.10333735917376988,
       "Fac2": 0.8225806451612904,
       "HitRate": 0.6129032258064516,
       "Mg": 1.2180466506490562,
       "Vg": 1.6146556858553873,
       "GeometricPairs": 158,
       "R": 0.9535278045093767
      },
      "velocity.V": {
       "Count": 186,
       "MeanObserved": -0.04043331585512722,
       "MeanPredicted": -0.048693310770014236,
       "Fb": null,
       "Nmse": null,
       "Nad": null,
       "Fac2": 0.3602150537634409,
       "HitRate": 0.9032258064516129,
       "Mg": 4.000189640361174,
       "Vg": 4679.305126166496,
       "GeometricPairs": 44,
       "R": 0.9621359539198044
      },
      "velocity.W": {
       "Count": 186,
       "MeanObserved": 0.0013814965654127857,
       "MeanPredicted": 0.007283930921819746,
       "Fb": -1.362295020090697,
       "Nmse": 409.8493871310459,
       "Nad": 4.174502010073533,
       "Fac2": 0.4032258064516129,
       "HitRate": 0.8333333333333334,
       "Mg": 0.9432259896165625,
       "Vg": 2.429472999275036,
       "GeometricPairs": 66,
       "R": 0.7091597829771744
      },
      "speed": {
       "Count": 186,
       "MeanObserved": 0.6738722238666145,
       "MeanPredicted": 0.5917719968707627,
       "Fb": 0.12973666003550258,
       "Nmse": 0.05421819016726797,
       "Nad": 0.08815145021586458,
       "Fac2": 0.8655913978494624,
       "HitRate": 0.6666666666666666,
       "Mg": 1.209965071925292,
       "Vg": 1.3941044159798854,
       "GeometricPairs": 186,
       "R": 0.939760267128119
      },
      "k": {
       "Count": 186,
       "MeanObserved": 0.05589626736518246,
       "MeanPredicted": 0.03750724983720198,
       "Fb": 0.3937542841804471,